{"schema":"grapholog.graph.v1","snapshot_id":"5cd4f75b55171f409310620e87c443e0dca346a19adc9d4578cc9ce5bf82e5d8","summary":{"counts":{"clone_groups":3,"cross_project_groups":3,"edges":53,"excluded_entries":3,"files":15,"nodes":39,"projects":3,"symbols":9},"coverage_complete_within_policy":true,"engine":{"engine":"python","parser_identity":{"code":{"cache.py":"e4c47b657ca9ab9fbe1ea0348829a82a6ecb4068eb020ebcfaa6bd4adcdb3fef","model.py":"55b281cae867b1adb5133d7dfde02a9001e23eb8ee0ab6457fce181ceb68edee","python_parser.py":"60708f3bad3c857e3bdfed7866d44b9503de6458265cbce77245789e19d79c0e","tree_parser.py":"f23a79066267e408d99e41a4979d7aa0916f0712d38b8a5b1d87614f9ae5deb0"},"engine":"python","format":"grapholog.parse-cache.v1","interpreter":["cpython",3,12,14],"packages":{"tree-sitter":"0.25.2","tree-sitter-bash":"0.25.1","tree-sitter-javascript":"0.25.0","tree-sitter-php":"0.24.1","tree-sitter-typescript":"0.23.2"},"version":"0.5.0"}},"excluded_reasons":{"generated-or-tool-directory":3},"limitations":["Static syntax/call candidates; not semantic equivalence or purity.","Cross-project groups compare the same language and parser only.","Imports/calls resolve within each project; external package identities are not inferred.","Directory pruning counts entries, not unknown descendants. Tests and license context are retained.","repeated_nodes is a syntactic ranking heuristic; nested symbols can overlap. Not saved LOC.","A committed index is a scan result, not an atomic filesystem snapshot."],"profile":"logic","version":"0.5.0"},"nodes":[{"id":"f_08e8efaa0db254a12e46ab975e9e7ee9","kind":"file","label":"LICENSE","language":"other","lines":1,"nodes":0,"parser":"none","path":"LICENSE","project_id":"p_f8ecc289bb90f63f1ceebbec31147ecc","role":"context","sha256":"5a6764ee8c6b30c7b2dfcad7189892a23bf71849f597b7ddb13f48c6723483c9","status":"text","symbol_count":0},{"id":"f_1bd2c36a61e1fb2b8a709a158446bb07","kind":"file","label":"LICENSE","language":"other","lines":1,"nodes":0,"parser":"none","path":"LICENSE","project_id":"p_1334678105064afe2a736ebbc26d844c","role":"context","sha256":"5a6764ee8c6b30c7b2dfcad7189892a23bf71849f597b7ddb13f48c6723483c9","status":"text","symbol_count":0},{"id":"f_4124c1520f43342911882d1d0ed2f973","kind":"file","label":"main.py","language":"python","lines":7,"nodes":24,"parser":"python.ast","path":"main.py","project_id":"p_f8ecc289bb90f63f1ceebbec31147ecc","role":"source","sha256":"930488061dbf073b0676b56d547ac8d4d23ec41ab4f7f35cdd4029e355ec86b7","status":"parsed","symbol_count":1},{"id":"f_585e26790e223d2588e15ef43b83f02b","kind":"file","label":"pyproject.toml","language":"other","lines":3,"nodes":0,"parser":"none","path":"pyproject.toml","project_id":"p_f8ecc289bb90f63f1ceebbec31147ecc","role":"context","sha256":"f5d95d169d17e6072b2eb7f37a648275138a447291942fc29f7921103e7724b4","status":"text","symbol_count":0},{"id":"f_5ad384d09e37dace90df9b9ad84dd5b0","kind":"file","label":"main.py","language":"python","lines":7,"nodes":24,"parser":"python.ast","path":"main.py","project_id":"p_33f7b61c6e0c31edcc17f36ef635aced","role":"source","sha256":"f8ebc2184bc81a9c0f3fb2c5cd649967ecf9253c3bbafd7d697d22a16f3aaa73","status":"parsed","symbol_count":1},{"id":"f_5d248734773407154d81a454b4bf2bf3","kind":"file","label":"tests/test_keys.py","language":"python","lines":4,"nodes":13,"parser":"python.ast","path":"tests/test_keys.py","project_id":"p_1334678105064afe2a736ebbc26d844c","role":"test","sha256":"1ee57fe8db12e1440d6b3ba2bdecfb6dfe8b31b0eb8945d0412c99e8a76f16e2","status":"parsed","symbol_count":1},{"id":"f_648dd0de5b307a584f92d77e93f91791","kind":"file","label":"pyproject.toml","language":"other","lines":3,"nodes":0,"parser":"none","path":"pyproject.toml","project_id":"p_1334678105064afe2a736ebbc26d844c","role":"context","sha256":"ac47886d72319b349c0fffbab4650e3a2ac3282066f0ef2976dfdfa3ad29897c","status":"text","symbol_count":0},{"id":"f_6b5f707e5b87795cb563894cb52e67a1","kind":"file","label":"src/keys.py","language":"python","lines":4,"nodes":24,"parser":"python.ast","path":"src/keys.py","project_id":"p_f8ecc289bb90f63f1ceebbec31147ecc","role":"source","sha256":"f3c1c6821cbb45676c47f856363b5aacf06aa1718845e1764ea8a13589dfbf47","status":"parsed","symbol_count":1},{"id":"f_7a462c52894844caf0b4815b922fb186","kind":"file","label":"tests/test_keys.py","language":"python","lines":4,"nodes":13,"parser":"python.ast","path":"tests/test_keys.py","project_id":"p_33f7b61c6e0c31edcc17f36ef635aced","role":"test","sha256":"0bd8da337f7c14c337dfbc900a0cd4af0622a8cf9e5746ea8afa9d2fb9ce92ac","status":"parsed","symbol_count":1},{"id":"f_7edd1b0ff3556ec1021277399aa02159","kind":"file","label":"main.py","language":"python","lines":7,"nodes":24,"parser":"python.ast","path":"main.py","project_id":"p_1334678105064afe2a736ebbc26d844c","role":"source","sha256":"22964415a6a7646af1e9fa089fc7d0b0f2bde13a9bb5f2fa2ac6181b429aa51e","status":"parsed","symbol_count":1},{"id":"f_a5317f086976582b10f8c2d30869de64","kind":"file","label":"pyproject.toml","language":"other","lines":3,"nodes":0,"parser":"none","path":"pyproject.toml","project_id":"p_33f7b61c6e0c31edcc17f36ef635aced","role":"context","sha256":"6cc45353847c772f76a0be6cf2801c38035f1946f18eaa7409e2dd548ebb170d","status":"text","symbol_count":0},{"id":"f_c8f63cf42e703253fd439dff9d96748d","kind":"file","label":"LICENSE","language":"other","lines":1,"nodes":0,"parser":"none","path":"LICENSE","project_id":"p_33f7b61c6e0c31edcc17f36ef635aced","role":"context","sha256":"5a6764ee8c6b30c7b2dfcad7189892a23bf71849f597b7ddb13f48c6723483c9","status":"text","symbol_count":0},{"id":"f_d7716672d126a4915e37441861e066d8","kind":"file","label":"src/keys.py","language":"python","lines":4,"nodes":24,"parser":"python.ast","path":"src/keys.py","project_id":"p_33f7b61c6e0c31edcc17f36ef635aced","role":"source","sha256":"20940e5d116583ff8518c2134173d424c1980c9127708e6c35f138781fd9c605","status":"parsed","symbol_count":1},{"id":"f_e6628da960a49fa297185f529ae95404","kind":"file","label":"src/keys.py","language":"python","lines":4,"nodes":24,"parser":"python.ast","path":"src/keys.py","project_id":"p_1334678105064afe2a736ebbc26d844c","role":"source","sha256":"ff9dfd76e6e847f9e44e91264e252551f3e7a7ab0dce21ccd61e50cd791dbdb7","status":"parsed","symbol_count":1},{"id":"f_e8ff8b1a133ff8cabe0c4a07a1e1e48a","kind":"file","label":"tests/test_keys.py","language":"python","lines":4,"nodes":13,"parser":"python.ast","path":"tests/test_keys.py","project_id":"p_f8ecc289bb90f63f1ceebbec31147ecc","role":"test","sha256":"66553efb576e6e5bb1099d71880d2174844978457677aff180fff7c050d53a1d","status":"parsed","symbol_count":1},{"effects":"unknown","equivalence":"identifier-shape-heuristic","fingerprint":"cca32f58b93a5cbc25240abe1880f1cf0a9959256d31dcc63c1b8bddc9e7eec0","id":"g_6af86baad277d480f598f037e07a0f58","kind":"clone_group","language":"python","match":"function-shape","occurrences":3,"parser":"python.ast","project_count":3,"repeated_nodes":42,"semantic_equivalence_proven":false},{"effects":"unknown","equivalence":"identifier-shape-heuristic","fingerprint":"c4b8b27222bb2ddbc824c3d8ad21a39e38cb1e5c194f2b487bc15621f8e965d5","id":"g_e10e710efec2469856bfb3e6f1c2e885","kind":"clone_group","language":"python","match":"function-shape","occurrences":3,"parser":"python.ast","project_count":3,"repeated_nodes":46,"semantic_equivalence_proven":false},{"effects":"unknown","equivalence":"syntax-except-declaration-name","fingerprint":"f52801674f5ff0f55610434f35f0cba9b48dd53c5e4f05076e7b9d66fad52a4b","id":"g_f9fbc347c718283e73bd3b48e66f3560","kind":"clone_group","language":"python","match":"function-body","occurrences":2,"parser":"python.ast","project_count":2,"repeated_nodes":23,"semantic_equivalence_proven":false},{"coverage":{"complete_within_policy":true,"excluded_entries":1,"excluded_reasons":{"generated-or-tool-directory":1},"known_skipped_bytes":0,"statuses":{"parsed":3,"text":2}},"cycles":[],"id":"p_1334678105064afe2a736ebbc26d844c","kind":"project","label":"analytics","options":{"all_files":false,"default_excludes":[".git",".hg",".mypy_cache",".next",".pytest_cache",".ruff_cache",".svn",".tox",".venv","__pycache__","build","coverage","dist","node_modules","target","vendor","venv"],"effective_patterns":[],"exclude":[],"max_parse_bytes":2097152,"profile":"logic-v1","source_roots":[".","src"]},"project_id":"p_1334678105064afe2a736ebbc26d844c","warnings":[]},{"coverage":{"complete_within_policy":true,"excluded_entries":1,"excluded_reasons":{"generated-or-tool-directory":1},"known_skipped_bytes":0,"statuses":{"parsed":3,"text":2}},"cycles":[],"id":"p_33f7b61c6e0c31edcc17f36ef635aced","kind":"project","label":"orders","options":{"all_files":false,"default_excludes":[".git",".hg",".mypy_cache",".next",".pytest_cache",".ruff_cache",".svn",".tox",".venv","__pycache__","build","coverage","dist","node_modules","target","vendor","venv"],"effective_patterns":[],"exclude":[],"max_parse_bytes":2097152,"profile":"logic-v1","source_roots":[".","src"]},"project_id":"p_33f7b61c6e0c31edcc17f36ef635aced","warnings":[]},{"coverage":{"complete_within_policy":true,"excluded_entries":1,"excluded_reasons":{"generated-or-tool-directory":1},"known_skipped_bytes":0,"statuses":{"parsed":3,"text":2}},"cycles":[],"id":"p_f8ecc289bb90f63f1ceebbec31147ecc","kind":"project","label":"billing","options":{"all_files":false,"default_excludes":[".git",".hg",".mypy_cache",".next",".pytest_cache",".ruff_cache",".svn",".tox",".venv","__pycache__","build","coverage","dist","node_modules","target","vendor","venv"],"effective_patterns":[],"exclude":[],"max_parse_bytes":2097152,"profile":"logic-v1","source_roots":[".","src"]},"project_id":"p_f8ecc289bb90f63f1ceebbec31147ecc","warnings":[]},{"file_id":"f_e8ff8b1a133ff8cabe0c4a07a1e1e48a","id":"s_4df5939b7e1550f182169f0db5b2ff35","kind":"symbol","label":"test_blank","language":"python","parser":"python.ast","path":"tests/test_keys.py","project_id":"p_f8ecc289bb90f63f1ceebbec31147ecc","role":"test","sha256":"66553efb576e6e5bb1099d71880d217484